9999	LABEL:UYYbisXZ	Paragraph_ID	Book_Paragraph_ID	Paragraph_Reference	CollectedHitRankSummary	CollectedHits	TokensInParagraph	TotalUniquedScore	TotalUniquedScorePercentage	TotalHitCount	HitTypeTokenRatio	SummaryUnique_Hits_U	Unique_Hits_U	SummaryUnique_Hits_Y	Unique_Hits_Y	SummaryUnique_Hits_Ybis	Unique_Hits_Ybis	SummaryUnique_Hits_X	Unique_Hits_X	SummaryUnique_Hits_Z	Unique_Hits_Z	Paragraph_(lemmatized)	Paragraph_(tokenized)
3	NYNNN	P_000169	B_0000P_0169	I2103.12308v1.p.60	Y:3:1	-- interpretability[1] -- -- --	522	1	0.19	1	100.00	n.a.	--	Y:3:1	interpretability[1]	n.a.	--	n.a.	--	n.a.	--	LEM:we design the interpretability metric * activation precision * to quantify what proportion of the information use to classify the mass margin come from the relevant region as mark by the radiologist-annotator . use the notation define in section [ 3.5 ] ( # sec : model_training ) { reference-type = " ref " reference = " sec : model_training " } , the activation precision for a single prototype $ \ mathbf {p}_j $ on a single image $ \ mathbf {x}_i $ that have mass-margin type $ y ^ { \ text{margin} } _ i $ and come with a fine-annotation mask $ \ mathbf {m}_i $ , be define as : $ $ \ label { eq : ap } \ textrm{ap} ( \ mathbf {p}_j , \ mathbf {x}_i , y ^ { \ text{margin} } _ i , \ mathbf {m}_i ) = \ leave ( \ frac { \ sum \ leave [ ( 1 - \ mathbf {m}_i ) \ odot t _ { \ tau } \ leave ( \ textrm{upsample} \ leave ( g _ { \ mathbf {p}_j } ( f ( \ mathbf {x}_i ) ) \ right ) \ right ) \ right ] } { \ sum t _ { \ tau } \ leave ( \ textrm{upsample} \ leave ( g _ { \ mathbf {p}_j } ( f ( \ mathbf {x}_i ) ) \ right ) \ right ) } \ right ) \ text { where } \ text{class} ( \ mathbf {p}_j ) = y ^ { \ text{margin} } _ i , $ $ where $ t _ { \ tau } $ be a threshold function that return the top $ ( 1 - \ tau ) \ time 100 \ % $ of the input value as $ 1 $ and the bottom $ \ tau \ time 100 \ % $ as $ 0 $ . activation precision be only define where the prototype have the same class identity as the image . the fraction in equation ( [ \ [ eq : ap \ ] ] ( # eq : ap ) { reference-type = " ref " reference = " eq : ap " } ) give a proportion of highly activate pixel that be medically relevant . we elaborate on this in appendix [ 15 ] ( # app : activation_precision ) { reference-type = " ref " reference = " app : activation_precision " } . to evaluate activation precision for gradcam [ @ selvaraju _ 2017 _ iccv ] and gradcam++ [ @ chattopadhay 2018 grad ] , we calculate as in equation ( [ \ [ eq : ap \ ] ] ( # eq : ap ) { reference-type = " ref " reference = " eq : ap " } ) but replace the prototype activation map $ \ textrm{upsample} \ leave ( g _ { \ mathbf {p}_j } ( f ( \ mathbf {x}_i ) ) \ right ) $ with the normalize gradient map for the correct class . 	TOK:We designed the interpretability metric * activation precision * to quantify what proportion of the information used to classify the mass margin comes from the relevant region as marked by the radiologist-annotator . Using the notations defined in Section [ 3.5 ] ( # sec : model_training ) { reference-type = " ref " reference = " sec : model_training " } , the activation precision for a single prototype $ \ mathbf {p}_j $ on a single image $ \ mathbf {x}_i $ that has mass-margin type $ y ^ { \ text{margin} } _ i $ and comes with a fine-annotation mask $ \ mathbf {m}_i $ , is defined as : $ $ \ label { eq : ap } \ textrm{AP} ( \ mathbf {p}_j , \ mathbf {x}_i , y ^ { \ text{margin} } _ i , \ mathbf {m}_i ) = \ left ( \ frac { \ sum \ left [ ( 1 - \ mathbf {m}_i ) \ odot T _ { \ tau } \ left ( \ textrm{Upsample} \ left ( g _ { \ mathbf {p}_j } ( f ( \ mathbf {x}_i ) ) \ right ) \ right ) \ right ] } { \ sum T _ { \ tau } \ left ( \ textrm{Upsample} \ left ( g _ { \ mathbf {p}_j } ( f ( \ mathbf {x}_i ) ) \ right ) \ right ) } \ right ) \ text { where } \ text{class} ( \ mathbf {p}_j ) = y ^ { \ text{margin} } _ i , $ $ where $ T _ { \ tau } $ is a threshold function that returns the top $ ( 1 - \ tau ) \ times 100 \ % $ of the input values as $ 1 $ and the bottom $ \ tau \ times 100 \ % $ as $ 0 $ . Activation precision is only defined where the prototype has the same class identity as the image . The fraction in Equation ( [ \ [ eq : ap \ ] ] ( # eq : ap ) { reference-type = " ref " reference = " eq : ap " } ) gives a proportion of highly activated pixels that are medically relevant . We elaborate on this in Appendix [ 15 ] ( # app : activation_precision ) { reference-type = " ref " reference = " app : activation_precision " } . To evaluate activation precision for GradCAM [ @ Selvaraju _ 2017 _ ICCV ] and GradCAM++ [ @ chattopadhay 2018 grad ] , we calculate as in Equation ( [ \ [ eq : ap \ ] ] ( # eq : ap ) { reference-type = " ref " reference = " eq : ap " } ) but replace the prototype activation map $ \ textrm{Upsample} \ left ( g _ { \ mathbf {p}_j } ( f ( \ mathbf {x}_i ) ) \ right ) $ with the normalized gradient map for the correct class . 
3	NYNNN	P_000172	B_0000P_0172	I2103.12308v1.p.63	Y:3:1	-- interpretability[1] -- -- --	88	1	1.14	1	100.00	n.a.	--	Y:3:1	interpretability[1]	n.a.	--	n.a.	--	n.a.	--	LEM:activation precision be a measure of interpretability , in the sense that the high the activation precision , the well a prototype ( or a set of prototype ) be at detect medically relevant feature for mass-margin classification . in our experiment , we use $ \ tau = 0.95 $ because iaia-bl use the top 5 % of activate patch in its prediction . 95 % confidence interval be derive use non-parametric bootstrap resample with 5000 sample each equal to the size of the test set . 	TOK:Activation precision is a measure of interpretability , in the sense that the higher the activation precision , the better a prototype ( or a set of prototypes ) is at detecting medically relevant features for mass-margin classification . In our experiments , we used $ \ tau = 0.95 $ because IAIA-BL uses the top 5 % of activated patches in its predictions . 95 % confidence intervals were derived using non-parametric bootstrap resampling with 5000 samples each equal to the size of the test set . 
3	NYNNN	P_000178	B_0000P_0178	I2103.12308v1.p.69	Y:3:1	-- interpretability[1] -- -- --	124	1	0.81	1	100.00	n.a.	--	Y:3:1	interpretability[1]	n.a.	--	n.a.	--	n.a.	--	LEM:* * baseline 2 a and 2 b : vgg -16 [ @ simonyan 2015 very ] with gradcam [ @ selvaraju _ 2017 _ iccv ] and gradcam++ [ @ chattopadhay 2018 grad ] . * * we train a vgg -16 model with two add fully connect layer to account for the large number of parameter in our model . pre-traine on imagenet , it be train for 250 epoch and the epoch with the high test accuracy be select for comparison . there be no native way to incorporate our fine annotation into vgg -16 . vgg -16 provide no inherent interpretability or localization . use the posthoc gradcam and gradcam++ technique we show localization information and calculate activation precision . 	TOK:* * Baselines 2 a and 2 b : VGG -16 [ @ simonyan 2015 very ] with GradCAM [ @ Selvaraju _ 2017 _ ICCV ] and GradCAM++ [ @ chattopadhay 2018 grad ] . * * We trained a VGG -16 model with two added fully connected layers to account for the larger number of parameters in our model . Pre-trained on ImageNet , it was trained for 250 epochs and the epoch with the highest test accuracy is selected for comparison . There is no native way to incorporate our fine annotation into VGG -16 . VGG -16 provides no inherent interpretability or localization . Using the posthoc GradCAM and GradCAM++ techniques we show localization information and calculate activation precision . 
3	NYNNN	P_000185	B_0000P_0185	I2103.12308v1.p.76	Y:3:1	-- interpretability[1] -- -- --	447	1	0.22	1	100.00	n.a.	--	Y:3:1	interpretability[1]	n.a.	--	n.a.	--	n.a.	--	LEM:& \ & & & vgg -16 [ @ simonyan 2015 very ] & vgg -16 [ @ simonyan 2015 very ] \ & iaia-bl & protopnet [ @ ppnet ] & with gradcam [ @ selvaraju _ 2017 _ iccv ] & with gradcam++ [ @ chattopadhay 2018 grad ] \ performance ( auroc ) & & & & \ mass margin class . & * * 0.951 * * \ [ 0.905 , 0.996 \ ] & * 0.911 * \ [ 0.848 , 0.974 \ ] & * 0.947 * \ [ 0.898 , 0.996 \ ] & * 0.947 * \ [ 0.898 , 0.996 \ ] \ spiculate vs. all & * 0.96 * \ [ 0.90 , 1.00 \ ] & * * 0.97 * * \ [ 0.93 , 1.00 \ ] & * 0.95 * \ [ 0.89 , 1.00 \ ] & * 0.95 * \ [ 0.89 , 1.00 \ ] \ indistinct vs. all & * 0.93 * \ [ 0.88 , 0.99 \ ] & * 0.87 * \ [ 0.78 , 0.94 \ ] & * * 0.94 * * \ [ 0.89 , 0.99 \ ] & * * 0.94 * * \ [ 0.89 , 0.99 \ ] \ circumscribed vs. all & * * 0.97 * * \ [ 0.94 , 1.00 \ ] & * 0.93 * \ [ 0.87 , 1.00 \ ] & * 0.95 * \ [ 0.91 , 1.00 \ ] & * 0.95 * \ [ 0.91 , 1.00 \ ] \ cohen 's $ \ kappa $ & * * 0.74 * * \ [ 0.60 , 0.86 \ ] & * 0.64 * \ [ 0.49 , 0.78 \ ] & * * 0.74 * * \ [ 0.60 , 0.87 \ ] & * * 0.74 * * \ [ 0.60 , 0.87 \ ] \ interpretability & & & & \ fine-scale act . prec . & * * 0.41 * * \ [ 0.39 , 0.45 \ ] & 0.24 \ [ 0.17 , 0.31 \ ] & 0.21 \ [ 0.05 , 0.43 \ ] $ ^ { \ textrm{a} } $ & 0.24 \ [ 0.08 , 0.45 \ ] $ ^ { \ textrm{a} } $ \ lesion-scale act . prec . & * * 0.94 * * \ [ 0.92 , 0.97 \ ] & 0.51 \ [ 0.34 , 0.68 \ ] & 0.45 \ [ 0.37 , 0.54 \ ] $ ^ { \ textrm{a} } $ & 0.53 \ [ 0.44 , 0.61 \ ] $ ^ { \ textrm{a} } $ \ 	TOK:& \ & & & VGG -16 [ @ simonyan 2015 very ] & VGG -16 [ @ simonyan 2015 very ] \ & IAIA-BL & ProtoPNet [ @ PPNet ] & with GradCAM [ @ Selvaraju _ 2017 _ ICCV ] & with GradCAM++ [ @ chattopadhay 2018 grad ] \ Performance ( AUROC ) & & & & \ Mass Margin Class . & * * 0.951 * * \ [ 0.905 , 0.996 \ ] & * 0.911 * \ [ 0.848 , 0.974 \ ] & * 0.947 * \ [ 0.898 , 0.996 \ ] & * 0.947 * \ [ 0.898 , 0.996 \ ] \ Spiculated vs. all & * 0.96 * \ [ 0.90 , 1.00 \ ] & * * 0.97 * * \ [ 0.93 , 1.00 \ ] & * 0.95 * \ [ 0.89 , 1.00 \ ] & * 0.95 * \ [ 0.89 , 1.00 \ ] \ Indistinct vs. all & * 0.93 * \ [ 0.88 , 0.99 \ ] & * 0.87 * \ [ 0.78 , 0.94 \ ] & * * 0.94 * * \ [ 0.89 , 0.99 \ ] & * * 0.94 * * \ [ 0.89 , 0.99 \ ] \ Circumscribed vs. all & * * 0.97 * * \ [ 0.94 , 1.00 \ ] & * 0.93 * \ [ 0.87 , 1.00 \ ] & * 0.95 * \ [ 0.91 , 1.00 \ ] & * 0.95 * \ [ 0.91 , 1.00 \ ] \ Cohen 's $ \ kappa $ & * * 0.74 * * \ [ 0.60 , 0.86 \ ] & * 0.64 * \ [ 0.49 , 0.78 \ ] & * * 0.74 * * \ [ 0.60 , 0.87 \ ] & * * 0.74 * * \ [ 0.60 , 0.87 \ ] \ Interpretability & & & & \ Fine-scale Act . Prec . & * * 0.41 * * \ [ 0.39 , 0.45 \ ] & 0.24 \ [ 0.17 , 0.31 \ ] & 0.21 \ [ 0.05 , 0.43 \ ] $ ^ { \ textrm{a} } $ & 0.24 \ [ 0.08 , 0.45 \ ] $ ^ { \ textrm{a} } $ \ Lesion-scale Act . Prec . & * * 0.94 * * \ [ 0.92 , 0.97 \ ] & 0.51 \ [ 0.34 , 0.68 \ ] & 0.45 \ [ 0.37 , 0.54 \ ] $ ^ { \ textrm{a} } $ & 0.53 \ [ 0.44 , 0.61 \ ] $ ^ { \ textrm{a} } $ \ 
3	NYNNN	P_000188	B_0000P_0188	I2103.12308v1.p.79	Y:3:1	-- interpretability[1] -- -- --	110	1	0.91	1	100.00	n.a.	--	Y:3:1	interpretability[1]	n.a.	--	n.a.	--	n.a.	--	LEM:performance of iaia-bl be well than that of protopnet ( baseline 1 ) , which do not have the stabilization of the gradient provide by the average pooling improvement of iaia-bl . vgg -16 ( baseline 2 a and 2 b ) perform comparably to iaia-bl for auroc . remember that the baseline model be permit to use confound information that iaia-bl be not encourage to use , and we will see that when we consider the interpretability result . as we know , it be easy to perform well on training datum despite use logic that a radiologist would claim be incorrect [ @ zech 2018 variable ] . 	TOK:Performance of IAIA-BL is better than that of ProtoPNet ( Baseline 1 ) , which does not have the stabilization of the gradient provided by the average pooling improvement of IAIA-BL . VGG -16 ( Baselines 2 a and 2 b ) performed comparably to IAIA-BL for AUROC . Remember that the baseline models are permitted to use confounding information that IAIA-BL is not encouraged to use , and we will see that when we consider the interpretability results . As we know , it is easy to perform well on training data despite using logic that a radiologist would claim is incorrect [ @ zech 2018 variable ] . 
3	NYNNN	P_000190	B_0000P_0190	I2103.12308v1.p.81	Y:3:1	-- interpretability[3] -- -- --	143	1	0.70	3	33.33	n.a.	--	Y:3:1	interpretability[3]	n.a.	--	n.a.	--	n.a.	--	LEM:* * interpretability result : * * to measure interpretability , we use the interpretability metric activation precision from section [ 4.2 ] ( # subsec : activprec ) { reference-type = " ref " reference = " subsec : activprec " } , show in the low two row of table [ \ [ tab : margin_results \ ] ] ( # tab : margin_result ) { reference-type = " ref " reference = " tab : margin_result " } . for the unpruned iaia-bl model ( not show in the table , because it be almost identical to iaia-bl ) , the lesion-scale activation precision of the learn prototype be 0.93 ( 95 % ci : 0.91 , 0.96 ) and the fine-scale activation precision of the learn prototype be 0.41 ( 95 % ci : 0.39 , 0.43 ) . 	TOK:* * Interpretability Results : * * To measure interpretability , we used the interpretability metric activation precision from Section [ 4.2 ] ( # subsec : activprec ) { reference-type = " ref " reference = " subsec : activprec " } , shown in the lower two rows of Table [ \ [ tab : margin_results \ ] ] ( # tab : margin_results ) { reference-type = " ref " reference = " tab : margin_results " } . For the unpruned IAIA-BL model ( not shown in the table , because it is almost identical to IAIA-BL ) , the lesion-scale activation precision of the learned prototypes is 0.93 ( 95 % CI : 0.91 , 0.96 ) and the fine-scale activation precision of the learned prototypes is 0.41 ( 95 % CI : 0.39 , 0.43 ) . 
3	NYNNN	P_000192	B_0000P_0192	I2103.12308v1.p.83	Y:3:1	-- interpretability[1] -- -- --	72	1	1.39	1	100.00	n.a.	--	Y:3:1	interpretability[1]	n.a.	--	n.a.	--	n.a.	--	LEM:* * * to summarize , iaia-bl 's predictive performance be as good or well than the analogous black-box model . its performance in mimic our annotator be well than the typical interannotator agreement between radiologist . its interpretability , measure by how well its attention agree with a radiologist annotator 's hand-drawn attention map , exceed that of exist method and do not resort to post-hoc analysis . * * * 	TOK:* * * To summarize , IAIA-BL 's predictive performance was as good or better than the analogous black-box model . Its performance in mimicking our annotator was better than the typical interannotator agreement between radiologists . Its interpretability , measured by how well its attention agreed with a radiologist annotator 's hand-drawn attention maps , exceeded that of existing methods and does not resort to post-hoc analysis . * * * 
4	NYNNN	P_000201	B_0000P_0201	I2103.12308v1.p.92	Y:1:1Y:3:1	-- interpretability[1] interpretable_model[1] -- -- --	147	2	1.36	2	100.00	n.a.	--	Y:1:1 Y:3:1	interpretability[1] interpretable_model[1]	n.a.	--	n.a.	--	n.a.	--	LEM:the high performance of uninterpretable model that appear to be leverage mainly confound information be a point of concern when incorporate model into clinical practice . though a radiologist may not choose to view an explanation for every prediction , interpretable model still provide value over uninterpretable model . because we know that ai system fail [ @ zech 2018 variable ] , we design a system that can alert a radiologist to faulty reasoning at the time the prediction be make instead of only after the consequence of misprediction have be realize . the global interpretability ( namely , the set of prototype ) allow the train model to be fine-tuned by domain expert through pruning of prototype that do not correspond to medically relevant feature . the explanation provide can also be use for debug a model and for retrospective analysis of model failure . 	TOK:The high performance of uninterpretable models that appear to be leveraging mainly confounding information is a point of concern when incorporating models into clinical practice . Though a radiologist may not choose to view an explanation for every prediction , interpretable models still provide value over uninterpretable models . Because we know that AI systems fail [ @ zech 2018 variable ] , we designed a system that can alert a radiologist to faulty reasoning at the time the prediction is made instead of only after the consequences of misprediction have been realized . The global interpretability ( namely , the set of prototypes ) allows the trained model to be fine-tuned by domain experts through pruning of prototypes that do not correspond to medically relevant features . The explanations provided can also be used for debugging a model and for retrospective analysis of model failures . 
3	NYNNN	P_000252	B_0000P_0252	I2103.12308v1.p.143	Y:3:1	-- interpretability[2] -- -- --	123	1	0.81	2	50.00	n.a.	--	Y:3:1	interpretability[2]	n.a.	--	n.a.	--	n.a.	--	LEM:this architecture provide both local interpretability by explain each prediction in term of the similarity between a give input image and the learn prototype , as in figure [ \ [ fig : iaia_expls \ ] ] ( # fig : iaia_expls ) { reference-type = " ref " reference = " fig : iaia_expls " } , and global interpretability in term of the cluster structure of the latent feature space ( where semantically similar convolutional feature patch be cluster around prototype represent the same semantic concept ) . the set of learn prototype be provide in appendix [ 12 ] ( # app : prototype_set ) { reference-type = " ref " reference = " app : prototype_set " } . 	TOK:This architecture provides both local interpretability by explaining each prediction in terms of the similarity between a given input image and the learned prototypes , as in Figure [ \ [ fig : IAIA_expls \ ] ] ( # fig : IAIA_expls ) { reference-type = " ref " reference = " fig : IAIA_expls " } , and global interpretability in terms of the clustering structure of the latent feature space ( where semantically similar convolutional feature patches are clustered around prototypes representing the same semantic concepts ) . The set of learned prototypes is provided in Appendix [ 12 ] ( # app : prototype_sets ) { reference-type = " ref " reference = " app : prototype_sets " } . 
3	NYNNN	P_000268	B_0000P_0268	I2106.01043v1.p.1	Y:3:1	-- interpretability[1] -- -- --	292	1	0.34	1	100.00	n.a.	--	Y:3:1	interpretability[1]	n.a.	--	n.a.	--	n.a.	--	LEM:--- abstract : | in recent year , causal modelling have be use widely to improve generalization and to provide interpretability in machine learning model . to determine cause-effect relationship in the absence of a randomized trial , we can model causal system with counterfactual and intervention give enough domain knowledge . however , there be several case where domain knowledge be almost absent and the only recourse be use a statistical method to estimate causal relationship . while there have be several work do in estimate causal relationship in unstructured datum , we be yet to find a well-defined framework for estimate causal relationship in knowledge graphs ( kg ) . it be commonly use to provide a semantic framework for datum with complex inter-domain relationship . in this work , we define a hybrid approach that allow we to discover cause-effect relationship in kg . the propose approach be base around the finding of the instantaneous causal structure of a non-experimental matrix use a non-gaussian model , i.e ; find the causal ordering of the variable in a non-gaussian setting . the non-experimental matrix be a low-dimensional tensor projection obtain by decompose the adjacency tensor of a kg . we use two different pre-existe algorithm , one for the causal discovery and the other for decompose the kg and combine they to get the causal structure in a kg . author : - | rohan giriraj , sinnu susan thomas \ department of computer science and engineering \ digital university kerala ( iiitmk ) \ india 695317 \ ` rohan . mi 19 , sinnu.thomas@iiitmk.ac.in ` \ bibliography : - reference . bib title : ' causal discovery in knowledge graphs by exploit asymmetric properties of non-gaussian distributions ' --- 	TOK:--- abstract : | In recent years , causal modelling has been used widely to improve generalization and to provide interpretability in machine learning models . To determine cause-effect relationships in the absence of a randomized trial , we can model causal systems with counterfactuals and interventions given enough domain knowledge . However , there are several cases where domain knowledge is almost absent and the only recourse is using a statistical method to estimate causal relationships . While there have been several works done in estimating causal relationships in unstructured data , we are yet to find a well-defined framework for estimating causal relationships in Knowledge Graphs ( KG ) . It is commonly used to provide a semantic framework for data with complex inter-domain relationships . In this work , we define a hybrid approach that allows us to discover cause-effect relationships in KG . The proposed approach is based around the finding of the instantaneous causal structure of a non-experimental matrix using a non-Gaussian model , i.e ; finding the causal ordering of the variables in a non-Gaussian setting . The non-experimental matrix is a low-dimensional tensor projection obtained by decomposing the adjacency tensor of a KG . We use two different pre-existing algorithms , one for the causal discovery and the other for decomposing the KG and combining them to get the causal structure in a KG . author : - | Rohan Giriraj , Sinnu Susan Thomas \ Department of Computer Science and Engineering \ Digital University Kerala ( IIITMK ) \ India 695317 \ ` rohan . mi 19 , sinnu.thomas@iiitmk.ac.in ` \ bibliography : - references . bib title : ' Causal Discovery in Knowledge Graphs by Exploiting Asymmetric Properties of Non-Gaussian Distributions ' --- 
1	NYNNN	P_000270	B_0000P_0270	I2106.01043v1.p.3	Y:1:1	-- interpretable_model[1] -- -- --	334	1	0.30	1	100.00	n.a.	--	Y:1:1	interpretable_model[1]	n.a.	--	n.a.	--	n.a.	--	LEM:accord to pearl , causal inference be nothing more than a formalize approach to answer the simple question of " why " in statistic . most machine learning be base around the principle of correlation and usually operate under the assumption that the training and testing sample be $ i.i.d $ . i.e ; the training and testing sample belong to the same distribution . where machine learning fall short be in its ability to generalize from previous experience and transfer they to current problem . this be call * out-of-distribution * generalization [ @ schoelkopf 2019 ] . the implication of causal inference in machine learning have be huge , range from well , more interpretable model to helping solve adversarial vulnerability and enable robust generalization in common supervised learning task . there have be several know approach to define causality as a formal study of cause-effect relationship , the most prominent one be the neyman-rubin causal model ( c . 1923 ) which define the * fundamental problem of causal inference * \ [ insert reference here \ ] and a potential outcome ' framework as an alternative to randomized trial / experiment . pearl far extend the formal study of causality by define a structural causal model ( scm ) \ [ insert reference here pearl 2009 a . \ ] . the scm use a combination of structural equation and graphical causal diagram to represent causal relationship . the scm viewpoint be intuitive for machine learning which be base around the approximation of function . in the scm model , we have a set of observable $ x _ 1 , ... , x_n $ model as random variable associate with the vertex of direct acyclic graph . we assume each observable to be the result of a function which can be define as : $ $ \ label{scm} x_i : = f_i ( pa_i , u_i ) , ( i = 1 , ... , n ) $ $ 	TOK:According to Pearl , causal inference is nothing more than a formalized approach to answer the simple question of " Why " in statistics . Most machine learning is based around the principle of correlation and usually operates under the assumption that the training and testing samples are $ i.i.d $ . i.e ; the training and testing samples belong to the same distribution . Where machine learning falls short is in its ability to generalize from previous experiences and transfer them to current problems . This is called * out-of-distribution * generalization [ @ Schoelkopf 2019 ] . The implications of causal inference in machine learning have been huge , ranging from better , more interpretable models to helping solve adversarial vulnerability and enabling robust generalization in common supervised learning tasks . There have been several known approaches to define causality as a formal study of cause-effect relationships , the most prominent one being the Neyman-Rubin causal model ( c . 1923 ) which defines the * fundamental problem of causal inference * \ [ insert reference here \ ] and a potential outcomes ' framework as an alternative to randomized trials / experiments . Pearl further extended the formal study of causality by defining a structural causal model ( SCM ) \ [ insert reference here Pearl 2009 a . \ ] . The SCM uses a combination of structural equations and graphical causal diagrams to represent causal relationships . The SCM viewpoint is intuitive for machine learning which is based around the approximation of functions . In the SCM model , we have a set of observables $ X _ 1 , ... , X_n $ modelled as random variables associated with the vertices of directed acyclic graphs . We assume each observable to be the result of a function which can be defined as : $ $ \ label{scm} X_i : = f_i ( PA_i , U_i ) , ( i = 1 , ... , n ) $ $ 
