9999	LABEL:UYYbisXZ	Paragraph_ID	Book_Paragraph_ID	Paragraph_Reference	CollectedHitRankSummary	CollectedHits	TokensInParagraph	TotalUniquedScore	TotalUniquedScorePercentage	TotalHitCount	HitTypeTokenRatio	SummaryUnique_Hits_U	Unique_Hits_U	SummaryUnique_Hits_Y	Unique_Hits_Y	SummaryUnique_Hits_Ybis	Unique_Hits_Ybis	SummaryUnique_Hits_X	Unique_Hits_X	SummaryUnique_Hits_Z	Unique_Hits_Z	Paragraph_(lemmatized)	Paragraph_(tokenized)
3	NNNYN	P_000043	B_0000P_0043	I2010.07384v2.p.43	X:3:1	-- -- -- explainability[1] --	125	0	0.00	1	0.00	n.a.	--	n.a.	--	n.a.	--	X:3:1	explainability[1]	n.a.	--	LEM:the second row of fig . [ 3 ] ( # fig : cifar ) { reference-type = " ref " reference = " fig : cifar " } show global semantic explanation for these model , which correspond to aggregate local explanation across the datum set . we see that the trend find above for one particular image hold in general throughout the datum . our framework for semantic explainability thus lead to the interesting result that adversarially robust classifier be less sensitive to high-frequency information . see app . [ 6.2 ] ( # app : imagenet ) { reference-type = " ref " reference = " app : imagenet " } for similar result on imagenet [ @ imagenet 09 ] . 	TOK:The second row of Fig . [ 3 ] ( # fig : cifar ) { reference-type = " ref " reference = " fig : cifar " } shows global semantic explanations for these models , which correspond to aggregating local explanations across the data set . We see that the trends found above for one particular image hold in general throughout the data . Our framework for semantic explainability thus leads to the interesting result that adversarially robust classifiers are less sensitive to high-frequency information . See App . [ 6.2 ] ( # app : imagenet ) { reference-type = " ref " reference = " app : imagenet " } for similar results on ImageNet [ @ imagenet 09 ] . 
3	NNNYN	P_000049	B_0000P_0049	I2010.07384v2.p.49	X:3:1	-- -- -- explainability[1] --	91	0	0.00	1	0.00	n.a.	--	n.a.	--	n.a.	--	X:3:1	explainability[1]	n.a.	--	LEM:here we apply our explainability framework use unsupervise disentangled representation to extract the semantic feature . we do this on dsprites [ @ dsprites 17 ] , synthetic image of sprite ( see fig . [ 5 ] ( # fig : dsprite ) { reference-type = " ref " reference = " fig : dsprite " } ) generate from a know latent space with 5 dimension : shape , scale , orientation , and horizontal and vertical position . this experiment serve as a benchmark of our approach . 	TOK:Here we apply our explainability framework using unsupervised disentangled representations to extract the semantic features . We do this on dSprites [ @ dsprites 17 ] , synthetic images of sprites ( see Fig . [ 5 ] ( # fig : dsprites ) { reference-type = " ref " reference = " fig : dsprites " } ) generated from a known latent space with 5 dimensions : shape , scale , orientation , and horizontal and vertical positions . This experiment serves as a benchmark of our approach . 
3	NNNYN	P_000052	B_0000P_0052	I2010.07384v2.p.52	X:3:1	-- -- -- explainability[1] --	54	0	0.00	1	0.00	n.a.	--	n.a.	--	n.a.	--	X:3:1	explainability[1]	n.a.	--	LEM:this experiment validate our framework for semantic explainability , as the modelling task and factor of variation in the datum be fully understand and consistent with our result . moreover , this example showcase an explanation that differentiate between shape and scale -- semantic feature that cannot be distinguish in a pixel-based explanation . 	TOK:This experiment validates our framework for semantic explainability , as the modelling task and factors of variation in the data are fully understood and consistent with our results . Moreover , this example showcases an explanation that differentiates between shape and scale -- semantic features that cannot be distinguished in a pixel-based explanation . 
3	NNNYN	P_000060	B_0000P_0060	I2010.07384v2.p.60	X:3:1	-- -- -- explainability[1] --	149	0	0.00	1	0.00	n.a.	--	n.a.	--	n.a.	--	X:3:1	explainability[1]	n.a.	--	LEM:here we apply our explainability framework use image-to-image translation as the implicit semantic representation . we do this on celeba [ @ celeba 15 ] to demonstrate , on real world datum , that our method elucidate pattern in model behaviour that be miss by other method . in particular , we train a cnn to predict the label attractiveness of individual in the datum . we choose this admittedly banal label because it be influence by a variety of other high level attribute , include sensitive characteristic ( e.g. gender , age , skin tone ) that should not influence fair model prediction . pixel-based explanation ( e.g. fig . [ \ [ fig : pixel-baseline \ ] ] ( # fig : pixel-baseline ) { reference-type = " ref " reference = " fig : pixel-baseline " } ) provide no insight into these important issue . 	TOK:Here we apply our explainability framework using image-to-image translation as the implicit semantic representation . We do this on CelebA [ @ celeba 15 ] to demonstrate , on real world data , that our method elucidates patterns in model behaviour that are missed by other methods . In particular , we train a CNN to predict the labelled attractiveness of individuals in the data . We choose this admittedly banal label because it is influenced by a variety of other higher level attributes , including sensitive characteristics ( e.g. gender , age , skin tone ) that should not influence fair model predictions . Pixel-based explanations ( e.g. Fig . [ \ [ fig : pixel-baseline \ ] ] ( # fig : pixel-baseline ) { reference-type = " ref " reference = " fig : pixel-baseline " } ) provide no insight into these important issues . 
4	NYNYN	P_000067	B_0000P_0067	I2010.07384v2.p.67	Y:1:1,X:3:1	-- interpretable_model[1] -- explainability[1] --	122	1	0.82	2	50.00	n.a.	--	Y:1:1	interpretable_model[1]	n.a.	--	X:3:1	explainability[1]	n.a.	--	LEM:in this work , we have focus on explain model prediction in term of semantic latent feature rather than the model 's raw input . in related work , natural language processing be leveraged to produce interpretable model explanation textually [ @ groundingvisualexplantions ; @ nlpexplanation ] . other method [ @ conceptactivationvector ; @ interpretablebasisdecomposition ] learn to associate pattern of neuron activation with semantic concept . however , each of these require large set of annotate datum for training -- a barrier to widespread application -- whereas we offer both unsupervised and analytic option for semantic explainability in our approach . orthogonal effort exist to train high-capacity model that be intrinsically interpretable [ @ selfexplainingnn ; @ thislookslikesthat ] . 	TOK:In this work , we have focused on explaining model predictions in terms of semantic latent features rather than the model 's raw inputs . In related work , natural language processing is leveraged to produce interpretable model explanations textually [ @ GroundingVisualExplantions ; @ NLPexplanation ] . Other methods [ @ ConceptActivationVectors ; @ InterpretableBasisDecomposition ] learn to associate patterns of neuron activations with semantic concepts . However , each of these requires large sets of annotated data for training -- a barrier to widespread application -- whereas we offer both unsupervised and analytic options for semantic explainability in our approach . Orthogonal efforts exist to train high-capacity models that are intrinsically interpretable [ @ SelfExplainingNN ; @ ThisLooksLikesThat ] . 
3	NNNYN	P_000072	B_0000P_0072	I2010.07384v2.p.72	X:3:1	-- -- -- explainability[2] --	153	0	0.00	2	0.00	n.a.	--	n.a.	--	n.a.	--	X:3:1	explainability[2]	n.a.	--	LEM:in this work , we introduce an approach to model explainability on high-dimensional datum , in which explanation be articulate in term of a digestible set of semantic latent feature . we adapt the shapley paradigm to this task , in order to attribute a model 's prediction to the latent feature underlie its input datum . these two development form a principled , flexible framework for human-interpretable explainability on complex model . to demonstrate its flexibility , we highlight fourier transform , latent disentanglement , and image-to-image translation as option for the semantic representation that offer vary level of user control . we benchmarke our method on synthetic datum , where the underlie latent feature be control , and demonstrate its effectiveness in an extensive set of experiment use off-the-shelf pretraine model . we hope this framework will find wide applicability and offer practitioner a new way to probe their model . 	TOK:In this work , we introduced an approach to model explainability on high-dimensional data , in which explanations are articulated in terms of a digestible set of semantic latent features . We adapted the Shapley paradigm to this task , in order to attribute a model 's prediction to the latent features underlying its input data . These two developments form a principled , flexible framework for human-interpretable explainability on complex models . To demonstrate its flexibility , we highlighted Fourier transforms , latent disentanglement , and image-to-image translation as options for the semantic representation that offer varying levels of user control . We benchmarked our method on synthetic data , where the underlying latent features are controlled , and demonstrated its effectiveness in an extensive set of experiments using off-the-shelf pretrained models . We hope this framework will find wide applicability and offer practitioners a new way to probe their models . 
4	NYNNN	P_000110	B_0000P_0110	I2103.12308v1.p.1	Y:1:1Y:3:1	-- interpretability[2] interpretable_model[1] -- -- --	406	2	0.49	3	66.67	n.a.	--	Y:1:1 Y:3:1	interpretability[2] interpretable_model[1]	n.a.	--	n.a.	--	n.a.	--	LEM:--- abstract : | interpretability in machine learning model be important in high-stakes decision , such as whether to order a biopsy base on a mammographic exam . mammography pose important challenge that be not present in other computer vision task : dataset be small , confound information be present , and it can be difficult even for a radiologist to decide between watchful waiting and biopsy base on a mammogram alone . in this work , we present a framework for interpretable machine learning-based mammography . in addition to predict whether a lesion be malignant or benign , our work aim to follow the reasoning process of radiologist in detect clinically relevant semantic feature of each image , such as the characteristic of the mass margin . the framework include a novel interpretable neural network algorithm that use case-based reasoning for mammography . our algorithm can incorporate a combination of datum with whole image labelling and datum with pixel-wise annotation , lead to well accuracy and interpretability even with a small number of image . our interpretable model be able to highlight the classification-relevant part of the image , whereas other method highlight healthy tissue and confound information . our model be decision aid , rather than decision maker , aim at well overall human-machine collaboration . we do not observe a loss in mass margin classification accuracy over a black box neural network train on the same datum . author : - | alina jade barnett \ * duke university * \ alina . barnett \ @ duke . edu \ - | fides regina schwartz \ * duke university * \ fides . schwartz \ @ duke . edu \ - | chaofan tao \ * duke university * \ chaofan . tao \ @ gmail . com \ - | chaofan chen \ * university of maine * \ chaofan.ch en \ @ maine . edu \ - | yinhao ren \ * duke university * \ yinhao . ren \ @ duke . edu \ - | joseph y. lo \ * duke university * \ joseph . lo \ @ duke . edu \ - | cynthia rudin \ * duke university * \ cynthia \ @ cs . duke . edu \ bibliography : - main . bib title : ' iaia-bl : a case-based interpretable deep learning model for classification of mass lesion in digital mammography ' --- 	TOK:--- abstract : | Interpretability in machine learning models is important in high-stakes decisions , such as whether to order a biopsy based on a mammographic exam . Mammography poses important challenges that are not present in other computer vision tasks : datasets are small , confounding information is present , and it can be difficult even for a radiologist to decide between watchful waiting and biopsy based on a mammogram alone . In this work , we present a framework for interpretable machine learning-based mammography . In addition to predicting whether a lesion is malignant or benign , our work aims to follow the reasoning processes of radiologists in detecting clinically relevant semantic features of each image , such as the characteristics of the mass margins . The framework includes a novel interpretable neural network algorithm that uses case-based reasoning for mammography . Our algorithm can incorporate a combination of data with whole image labelling and data with pixel-wise annotations , leading to better accuracy and interpretability even with a small number of images . Our interpretable models are able to highlight the classification-relevant parts of the image , whereas other methods highlight healthy tissue and confounding information . Our models are decision aids , rather than decision makers , aimed at better overall human-machine collaboration . We do not observe a loss in mass margin classification accuracy over a black box neural network trained on the same data . author : - | Alina Jade Barnett \ * Duke University * \ alina . barnett \ @ duke . edu \ - | Fides Regina Schwartz \ * Duke University * \ Fides . Schwartz \ @ duke . edu \ - | Chaofan Tao \ * Duke University * \ chaofan . tao \ @ gmail . com \ - | Chaofan Chen \ * University of Maine * \ chaofan.ch en \ @ maine . edu \ - | Yinhao Ren \ * Duke University * \ yinhao . ren \ @ duke . edu \ - | Joseph Y. Lo \ * Duke University * \ joseph . lo \ @ duke . edu \ - | Cynthia Rudin \ * Duke University * \ cynthia \ @ cs . duke . edu \ bibliography : - main . bib title : ' IAIA-BL : A Case-based Interpretable Deep Learning Model for Classification of Mass Lesions in Digital Mammography ' --- 
1	NNNYN	P_000112	B_0000P_0112	I2103.12308v1.p.3	X:1:1	-- -- -- explainable[1] --	108	0	0.00	1	0.00	n.a.	--	n.a.	--	n.a.	--	X:1:1	explainable[1]	n.a.	--	LEM:! [ ( a ) uninterpretable approach give no explanation for their output . ( b ) other interpretable or explainable approach might point out which region be use for decision making , but provide no information about what attribute of the region be important for classification decision . ( c ) iaia-bl provide an explanation framework that localize relevant area , associate the relevant area with a specific medical feature and use only the explain evidence to make a prediction . ] ( . / fig / intro_fig_v 2 -2 . png ) { # fig : intro_fig width = " .8 \ \ linewidth " } 	TOK:! [ ( a ) Uninterpretable approaches give no explanations for their output . ( b ) Other interpretable or explainable approaches might point out which regions are used for decision making , but provide no information about what attributes of the region are important for classification decisions . ( c ) IAIA-BL provides an explanation framework that localizes relevant areas , associates the relevant area with a specific medical feature and uses only the explained evidence to make a prediction . ] ( . / figs / intro_fig_v 2 -2 . png ) { # fig : intro_fig width = " .8 \ \ linewidth " } 
4	NYNNN	P_000126	B_0000P_0126	I2103.12308v1.p.17	Y:1:1Y:3:1	-- interpretability[2] interpretable_model[1] -- -- --	113	2	1.77	3	66.67	n.a.	--	Y:1:1 Y:3:1	interpretability[2] interpretable_model[1]	n.a.	--	n.a.	--	n.a.	--	LEM:& ours & [ @ wu 2019 deep ] & [ @ kim 2018 icadx ] & [ @ wu 2018 deepminer ] \ inherently interpretable model ( not posthoc ) & & & & \ provide global interpretability ( on model ) & & & & \ provide local interpretability ( on each case ) & & & & \ explanation be guarantee to match model reasoning & & & & \ incorporate domain-specific terminology & & & & \ provide similar prototype for comparison & & & & \ can incorporate fine annotation & & & & \ can be train on datum with mixed labeling & & & & \ 	TOK:& Ours & [ @ wu 2019 deep ] & [ @ kim 2018 icadx ] & [ @ wu 2018 deepminer ] \ Inherently interpretable model ( not posthoc ) & & & & \ Provides global interpretability ( on model ) & & & & \ Provides local interpretability ( on each case ) & & & & \ Explanation is guaranteed to match model reasoning & & & & \ Incorporate domain-specific terminology & & & & \ Provides similar prototypes for comparison & & & & \ Can incorporate fine annotation & & & & \ Can be trained on data with mixed labeling & & & & \ 
1	NYNNN	P_000132	B_0000P_0132	I2103.12308v1.p.23	Y:1:1	-- interpretable_model[1] -- -- --	130	1	0.77	1	100.00	n.a.	--	Y:1:1	interpretable_model[1]	n.a.	--	n.a.	--	n.a.	--	LEM:model need to be collaborator in the medical decision-making process in order to be useful . in mammography , the initial clinical decision be express as a bi-rads category of 1 to 5 , correspond to the recommendation of whether the patient need a biopsy [ @ orel 1999 bi ; @ sickle 2013 acr ] . an inscrutable model predict malignant / benign be not useful as a decision aid , as a biopsy be recommend for every lesion with great than 2 % chance of malignancy ( bi-rads 4 and 5 ) . to alter clinical management , an interpretable model be need to describe its reasoning process for why the patient should or should not receive a biopsy rather than provide an inscrutable prediction of malignancy . 	TOK:Models need to be collaborators in the medical decision-making process in order to be useful . In mammography , the initial clinical decision is expressed as a BI-RADS category of 1 to 5 , corresponding to the recommendation of whether the patient needs a biopsy [ @ orel 1999 bi ; @ sickles 2013 acr ] . An inscrutable model predicting malignant / benign is not useful as a decision aid , as a biopsy is recommended for every lesion with greater than 2 % chance of malignancy ( BI-RADS 4 and 5 ) . To alter clinical management , an interpretable model is needed to describe its reasoning process for why the patient should or should not receive a biopsy rather than provide an inscrutable prediction of malignancy . 
3	NYNNN	P_000133	B_0000P_0133	I2103.12308v1.p.24	Y:3:1	-- interpretability[1] -- -- --	191	1	0.52	1	100.00	n.a.	--	Y:3:1	interpretability[1]	n.a.	--	n.a.	--	n.a.	--	LEM:our ai approach include an explicit reasoning system that resemble that of a practice radiologist . exist interpretability technique for mammography include localization as in figure [ 1 ] ( # fig : intro_fig ) { reference-type = " ref " reference = " fig : intro_fig " } b , but there be no explanation of why an area be select , what attribute of the region be use for classification , or what part of the training set these association be learn from . in a non-medical image analogy , though localization may provide a good interpretation for whether or not an image contain a vase ( perhaps by highlight the vase ) , it do not provide a good interpretation for classification of the vase pattern as roman vs $ . $ asian antiquity ( highlight the vase pattern provide no further insight ) . many recently publish ai-mammography algorithm be still entirely uninterpretable as in figure [ 1 ] ( # fig : intro_fig ) { reference-type = " ref " reference = " fig : intro_fig " } a [ @ mckinney 2020 international ] . 	TOK:Our AI approach includes an explicit reasoning system that resembles that of a practicing radiologist . Existing interpretability techniques for mammography include localization as in Figure [ 1 ] ( # fig : intro_fig ) { reference-type = " ref " reference = " fig : intro_fig " } b , but there is no explanation of why an area is selected , what attributes of the region are used for classification , or what parts of the training set these associations are learned from . In a non-medical image analogy , though localization may provide a good interpretation for whether or not an image contains a vase ( perhaps by highlighting the vase ) , it does not provide a good interpretation for classification of the vase pattern as Roman vs $ . $ Asian antiquity ( highlighting the vase pattern provides no further insight ) . Many recently published AI-mammography algorithms are still entirely uninterpretable as in Figure [ 1 ] ( # fig : intro_fig ) { reference-type = " ref " reference = " fig : intro_fig " } a [ @ mckinney 2020 international ] . 
1	NYNNN	P_000136	B_0000P_0136	I2103.12308v1.p.27	Y:1:1	-- interpretable_model[1] -- -- --	149	1	0.67	1	100.00	n.a.	--	Y:1:1	interpretable_model[1]	n.a.	--	n.a.	--	n.a.	--	LEM:when start to build an interpretable model for breast lesion classification , we naïvely apply the case-based reasoning protopnet architecture to medical image . though the model appear to be learn medically relevant feature because of its high validation accuracy , the model make prediction use region of the image that do not correspond to the medical information ; in other word , the model use confound information rather than medically relevant information . this be consistent with observation make by other group of the danger of confound in medical imaging [ @ wang 2019 remove ] . for non-medical image classification task , a typical approach might be to increase the size of the training set . however , as discuss above , one major barrier to implementation of ai in the medical field be the limited availability of annotate datum [ @ soffer 2019 convolutional ] . 	TOK:When starting to build an interpretable model for breast lesion classification , we naïvely applied the case-based reasoning ProtoPNet architecture to medical images . Though the model appeared to be learning medically relevant features because of its high validation accuracy , the model made predictions using regions of the image that did not correspond to the medical information ; in other words , the model used confounding information rather than medically relevant information . This is consistent with observations made by other groups of the dangers of confounding in medical imaging [ @ wang 2019 removing ] . For non-medical image classification tasks , a typical approach might be to increase the size of the training set . However , as discussed above , one major barrier to implementation of AI in the medical field is the limited availability of annotated data [ @ soffer 2019 convolutional ] . 
3	NYNNN	P_000147	B_0000P_0147	I2103.12308v1.p.38	Y:3:1	-- interpretability[2] -- -- --	124	1	0.81	2	50.00	n.a.	--	Y:3:1	interpretability[2]	n.a.	--	n.a.	--	n.a.	--	LEM:this architecture can provide both local interpretability by explain each prediction in term of the similarity between a give input image and the learn prototype , as in figure [ \ [ fig : iaia_expls \ ] ] ( # fig : iaia_expls ) { reference-type = " ref " reference = " fig : iaia_expls " } , and global interpretability in term of the cluster structure of the latent feature space ( where semantically similar convolutional feature patch be cluster around prototype represent the same semantic concept ) . the set of learn prototype be provide in appendix [ 12 ] ( # app : prototype_set ) { reference-type = " ref " reference = " app : prototype_set " } . 	TOK:This architecture can provide both local interpretability by explaining each prediction in terms of the similarity between a given input image and the learned prototypes , as in Figure [ \ [ fig : IAIA_expls \ ] ] ( # fig : IAIA_expls ) { reference-type = " ref " reference = " fig : IAIA_expls " } , and global interpretability in terms of the clustering structure of the latent feature space ( where semantically similar convolutional feature patches are clustered around prototypes representing the same semantic concepts ) . The set of learned prototypes is provided in Appendix [ 12 ] ( # app : prototype_sets ) { reference-type = " ref " reference = " app : prototype_sets " } . 
3	NYNNN	P_000168	B_0000P_0168	I2103.12308v1.p.59	Y:3:1	-- interpretability[1] -- -- --	9	1	11.11	1	100.00	n.a.	--	Y:3:1	interpretability[1]	n.a.	--	n.a.	--	n.a.	--	LEM:interpretability metric { # subsec : activprec } ----------------------- 	TOK:Interpretability Metric { # subsec : activprec } ----------------------- 
